{
  "$schema": "https://json-schema.org/draft/2020-12/schema",
  "$id": "https://agent-memory.local/harness/schema/capability.schema.json",
  "title": "CaptureFixture",
  "type": "object",
  "additionalProperties": false,
  "required": [
    "fixtureId",
    "cli",
    "nativeVersion",
    "capturedAt",
    "scenario",
    "observedEvents",
    "toolFailurePhasesObserved",
    "limitations",
    "rig"
  ],
  "properties": {
    "fixtureId": {
      "type": "string",
      "minLength": 1
    },
    "cli": {
      "type": "string",
      "enum": [
        "claude",
        "codex"
      ]
    },
    "nativeVersion": {
      "type": "string",
      "minLength": 1
    },
    "capturedAt": {
      "type": "string",
      "minLength": 1
    },
    "scenario": {
      "type": "string",
      "minLength": 1
    },
    "observedEvents": {
      "type": "array",
      "items": {
        "type": "object",
        "additionalProperties": false,
        "required": [
          "kind"
        ],
        "properties": {
          "kind": {
            "type": "string",
            "enum": [
              "session_started",
              "user_prompted",
              "assistant_completed",
              "tool_started",
              "tool_completed",
              "tool_failed",
              "turn_completed",
              "pre_compact",
              "post_compact",
              "session_idle",
              "session_interrupted",
              "session_ended",
              "raw"
            ]
          },
          "raw": true,
          "at": {
            "type": "string"
          },
          "capability": {
            "type": "string",
            "enum": [
              "native",
              "synthesized"
            ]
          },
          "sourceEvents": {
            "type": "array",
            "items": {
              "type": "string"
            }
          },
          "coverage": {
            "type": "number",
            "minimum": 0,
            "maximum": 1
          },
          "limitations": {
            "type": "array",
            "items": {
              "type": "string"
            }
          }
        },
        "allOf": [
          {
            "comment": "§7.2: synthesized は根拠 native event の明示が必須",
            "if": {
              "properties": {
                "capability": {
                  "const": "synthesized"
                }
              },
              "required": [
                "capability"
              ]
            },
            "then": {
              "required": [
                "sourceEvents"
              ],
              "properties": {
                "sourceEvents": {
                  "minItems": 1
                }
              }
            }
          }
        ]
      }
    },
    "toolFailurePhasesObserved": {
      "type": "array",
      "items": {
        "type": "string",
        "enum": [
          "executed",
          "permission_denied",
          "schema_invalid",
          "unknown_tool",
          "interrupt",
          "unknown"
        ]
      }
    },
    "limitations": {
      "type": "array",
      "items": {
        "type": "string"
      }
    },
    "evidenceHash": {
      "type": "string",
      "pattern": "^[a-f0-9]{64}$"
    },
    "rig": {
      "type": "object",
      "additionalProperties": false,
      "required": [
        "isolated",
        "internalRunMarker"
      ],
      "properties": {
        "isolated": {
          "type": "boolean",
          "const": true
        },
        "internalRunMarker": {
          "type": "boolean"
        }
      }
    },
    "highLevel": {
      "type": "object",
      "additionalProperties": false,
      "properties": {
        "sessionStartInjection": {
          "type": "string",
          "enum": [
            "native",
            "synthesized",
            "unsupported"
          ]
        },
        "promptAwareInjection": {
          "type": "string",
          "enum": [
            "native",
            "synthesized",
            "unsupported"
          ]
        },
        "promptDeliveryBeforeModel": {
          "type": "string",
          "enum": [
            "native",
            "synthesized",
            "unsupported"
          ]
        },
        "compactSingleDelivery": {
          "type": "string",
          "enum": [
            "native",
            "synthesized",
            "unsupported"
          ]
        },
        "trueSessionEnd": {
          "type": "string",
          "enum": [
            "native",
            "synthesized",
            "unsupported"
          ]
        },
        "subagentCapture": {
          "type": "string",
          "enum": [
            "native",
            "synthesized",
            "unsupported"
          ]
        },
        "stableNativeSessionId": {
          "type": "string",
          "enum": [
            "native",
            "synthesized",
            "unsupported"
          ]
        },
        "compactionRecoveryStrategy": {
          "type": "string",
          "enum": [
            "native_pre_and_post",
            "native_pre_next_prompt",
            "session_compaction_event",
            "turn_checkpoint_detect_reset",
            "unsupported"
          ]
        }
      }
    }
  }
}
